{
  "$schema": "./schemas/hardware-bom.schema.json",
  "schema_version": "1.0.0",
  "bom_id": "sdos-ai64-reference-bench",
  "revision": 1,
  "updated": "2026-10-18",
  "applies_to": {
    "board": "BeagleBone AI-64",
    "soc": "Texas Instruments TDA4VM/J721E",
    "course_release": "2026-candidate"
  },
  "items": [
    {
      "id": "board.ai64",
      "category": "board",
      "requirement_level": "required",
      "description": "BeagleBone AI-64 board with its supplied heatsink, a recorded stable identity, and no visible connector or PCB damage.",
      "quantity": {
        "technical_minimum": {
          "per_station": 1,
          "per_lab": 0,
          "minimum_total": 1
        },
        "recommended": {
          "per_station": 1,
          "per_lab": 0,
          "minimum_total": 1
        },
        "spares": {
          "fraction_of_recommended": 0.1,
          "minimum_total": 2
        }
      },
      "technical_minimum": {
        "product": "BeagleBone AI-64",
        "soc": "TDA4VM/J721E",
        "memory_gb": 4,
        "heatsink_required": true
      },
      "recommended": {
        "product": "BeagleBone AI-64",
        "soc": "TDA4VM/J721E",
        "memory_gb": 4,
        "heatsink_required": true,
        "asset_tag_required": true,
        "eeprom_identity_recorded": true,
        "soc_revision_recorded": true
      },
      "supported_examples": [
        {
          "manufacturer": "BeagleBoard.org Foundation",
          "model": "BeagleBone AI-64",
          "url": "https://docs.beagleboard.org/boards/beaglebone/ai-64/01-introduction.html",
          "notes": "The sole reference board. Record the PCB revision and SoC silicon revision separately for every observed unit."
        }
      ],
      "acceptance_checks": [
        {
          "id": "board.model",
          "method": "both",
          "criterion": "The physical marking and discovered board identity identify a BeagleBone AI-64."
        },
        {
          "id": "board.condition",
          "method": "manual",
          "criterion": "The supplied heatsink is present and the PCB, power, microSD, Ethernet, fan, and selected UART connectors have no visible damage."
        },
        {
          "id": "board.identity",
          "method": "automatic",
          "criterion": "A stable asset ID, board EEPROM serial and revision, and live SoC revision are recorded; missing exported fields are explicitly unavailable rather than inferred."
        }
      ],
      "automatic_discovery": [
        {
          "field": "board_identity",
          "source": "Board EEPROM name, serial number, and revision exposed by the running system",
          "limitations": "The EEPROM access path is image and kernel dependent; the PCB revision does not identify the SoC silicon revision."
        },
        {
          "field": "soc_identity",
          "source": "/sys/devices/soc* machine, family, soc_id, revision, and serial_number attributes",
          "limitations": "Individual sysfs attributes can be absent and must be recorded as unavailable."
        },
        {
          "field": "device_tree_model",
          "source": "/sys/firmware/devicetree/base/model and compatible",
          "limitations": "Device-tree identity describes the selected DTB and is corroborating evidence, not a unique asset identity."
        }
      ],
      "evidence": [
        {
          "claim": "The BeagleBone AI-64 uses a TDA4VM, has 4 GB LPDDR4, 16 GB eMMC, microSD, two 3.3 V debug UARTs, Gigabit Ethernet, a fan connector, and a supplied heatsink.",
          "url": "https://docs.beagleboard.org/boards/beaglebone/ai-64/01-introduction.html",
          "checked_on": "2026-10-18"
        },
        {
          "claim": "The board EEPROM format includes board name, revision, and serial number.",
          "url": "https://docs.beagleboard.org/boards/beaglebone/ai-64/03-design-and-specifications.html",
          "checked_on": "2026-10-18"
        },
        {
          "claim": "Linux defines SoC machine, family, serial_number, soc_id, and revision attributes under sysfs when a platform exports them.",
          "url": "https://www.kernel.org/doc/html/latest/admin-guide/abi-testing-files.html#abi-file-testing-sysfs-devices-soc",
          "checked_on": "2026-10-18"
        }
      ]
    },
    {
      "id": "power.5v4a",
      "category": "power_supply",
      "requirement_level": "required",
      "description": "Dedicated regulated 5 V, center-positive supply with at least 4 A rated output and a connector physically qualified on the reference board.",
      "quantity": {
        "technical_minimum": {
          "per_station": 1,
          "per_lab": 0,
          "minimum_total": 1
        },
        "recommended": {
          "per_station": 1,
          "per_lab": 0,
          "minimum_total": 1
        },
        "spares": {
          "fraction_of_recommended": 0.1,
          "minimum_total": 2
        }
      },
      "technical_minimum": {
        "output_voltage_v": 5,
        "continuous_current_a": 4,
        "regulated": true,
        "barrel_polarity": "center-positive"
      },
      "recommended": {
        "output_voltage_v": 5,
        "continuous_current_a": 4,
        "regulated": true,
        "barrel_polarity": "center-positive",
        "dedicated_per_station": true,
        "loaded_qualification_required": true
      },
      "supported_examples": [
        {
          "manufacturer": "Adafruit",
          "model": "5V 4A (4000mA) switching power supply",
          "part_number": "1466",
          "url": "https://www.adafruit.com/product/1466",
          "notes": "Candidate dedicated supply with 5.5 mm OD/2.1 mm ID center-positive plug. Physical fit and loaded stability must pass before fleet purchase because the board documentation does not publish barrel dimensions."
        }
      ],
      "acceptance_checks": [
        {
          "id": "power.label",
          "method": "manual",
          "criterion": "The supply label states regulated 5 V DC output at 4 A or greater; no higher-voltage-only supply is accepted."
        },
        {
          "id": "power.polarity",
          "method": "manual",
          "criterion": "Barrel polarity is center-positive and connector fit is secure on the sampled board."
        },
        {
          "id": "power.loaded",
          "method": "both",
          "criterion": "The board remains powered without reset or undervoltage indication under the qualification workload with the selected fan and normal bench peripherals."
        }
      ],
      "automatic_discovery": [],
      "evidence": [
        {
          "claim": "The board requires a 5 V supply and detailed BeagleBoard guidance specifies more than 3 A; attached peripherals can increase demand.",
          "url": "https://docs.beagleboard.org/boards/beaglebone/ai-64/03-design-and-specifications.html",
          "checked_on": "2026-10-18"
        },
        {
          "claim": "BeagleBoard documents at least 5 V/3 A through a matching center-positive barrel connector or USB-C for the AI-64.",
          "url": "https://docs.beagleboard.org/accessories/power-supplies.html",
          "checked_on": "2026-10-18"
        },
        {
          "claim": "The candidate supply is specified as regulated 5 V/4 A with a center-positive barrel plug.",
          "url": "https://www.adafruit.com/product/1466",
          "checked_on": "2026-10-18"
        }
      ]
    },
    {
      "id": "cooling.active",
      "category": "cooling",
      "requirement_level": "required",
      "description": "Active forced-air assembly for the supplied heatsink, electrically and mechanically qualified on the reference board and used for all course workloads and measurements.",
      "quantity": {
        "technical_minimum": {
          "per_station": 1,
          "per_lab": 0,
          "minimum_total": 1
        },
        "recommended": {
          "per_station": 1,
          "per_lab": 0,
          "minimum_total": 1
        },
        "spares": {
          "fraction_of_recommended": 0.1,
          "minimum_total": 2
        }
      },
      "technical_minimum": {
        "supply_voltage_v": 5,
        "forced_air_over_heatsink": true,
        "secure_mounting": true
      },
      "recommended": {
        "supply_voltage_v": 5,
        "forced_air_over_heatsink": true,
        "secure_mounting": true,
        "wire_count": 4,
        "tachometer": true,
        "pwm_control": true,
        "connector_qualified": true
      },
      "supported_examples": [
        {
          "manufacturer": "Noctua",
          "model": "NF-A4x10 5V PWM",
          "url": "https://www.noctua.at/en/products/nf-a4x10-5v-pwm/specifications",
          "notes": "Candidate 40 x 40 x 10 mm, 5 V, four-wire PWM/tach fan. It is not fleet-qualified until its mounting, board-side harness, header load, startup, tachometer, PWM behavior, and thermal result pass the listed checks."
        }
      ],
      "acceptance_checks": [
        {
          "id": "cooling.electrical",
          "method": "manual",
          "criterion": "The assembly is wired for the observed board revision with GND, 5 V, tachometer, and PWM on the verified pins and stays within the qualified header or external-supply current limit."
        },
        {
          "id": "cooling.mechanical",
          "method": "manual",
          "criterion": "The fan is securely mounted, directs air across the supplied heatsink, clears cables and moving parts, and cannot short the board."
        },
        {
          "id": "cooling.operation",
          "method": "both",
          "criterion": "The fan starts reliably at power-on; tachometer and PWM response are observed when board-header control is used, or an approved always-on external-power limitation is recorded."
        },
        {
          "id": "cooling.temperature",
          "method": "automatic",